{
  "refId": "pipe-sizes",
  "version": "1.0.0",
  "source": "ASME B36.10M-2022 (welded and seamless wrought steel pipe); ASME B36.19M-2018 (stainless steel pipe)",
  "note": "Outside diameter is fixed by the standard and is NOT derived from NPS. npsDecimal is the only summable column (ADR-007 section 9a) and is what makes dia-inch computable (ADR-010 section 1).",
  "units": {
    "odIn": "inch",
    "odMm": "millimetre"
  },
  "sizes": [
    {"nps": "1/8",   "npsDecimal": 0.125, "dn": 6,    "odIn": 0.405,  "odMm": 10.3},
    {"nps": "1/4",   "npsDecimal": 0.25,  "dn": 8,    "odIn": 0.540,  "odMm": 13.7},
    {"nps": "3/8",   "npsDecimal": 0.375, "dn": 10,   "odIn": 0.675,  "odMm": 17.1},
    {"nps": "1/2",   "npsDecimal": 0.5,   "dn": 15,   "odIn": 0.840,  "odMm": 21.3},
    {"nps": "3/4",   "npsDecimal": 0.75,  "dn": 20,   "odIn": 1.050,  "odMm": 26.7},
    {"nps": "1",     "npsDecimal": 1.0,   "dn": 25,   "odIn": 1.315,  "odMm": 33.4},
    {"nps": "1 1/4", "npsDecimal": 1.25,  "dn": 32,   "odIn": 1.660,  "odMm": 42.2},
    {"nps": "1 1/2", "npsDecimal": 1.5,   "dn": 40,   "odIn": 1.900,  "odMm": 48.3},
    {"nps": "2",     "npsDecimal": 2.0,   "dn": 50,   "odIn": 2.375,  "odMm": 60.3},
    {"nps": "2 1/2", "npsDecimal": 2.5,   "dn": 65,   "odIn": 2.875,  "odMm": 73.0},
    {"nps": "3",     "npsDecimal": 3.0,   "dn": 80,   "odIn": 3.500,  "odMm": 88.9},
    {"nps": "3 1/2", "npsDecimal": 3.5,   "dn": 90,   "odIn": 4.000,  "odMm": 101.6},
    {"nps": "4",     "npsDecimal": 4.0,   "dn": 100,  "odIn": 4.500,  "odMm": 114.3},
    {"nps": "5",     "npsDecimal": 5.0,   "dn": 125,  "odIn": 5.563,  "odMm": 141.3},
    {"nps": "6",     "npsDecimal": 6.0,   "dn": 150,  "odIn": 6.625,  "odMm": 168.3},
    {"nps": "8",     "npsDecimal": 8.0,   "dn": 200,  "odIn": 8.625,  "odMm": 219.1},
    {"nps": "10",    "npsDecimal": 10.0,  "dn": 250,  "odIn": 10.750, "odMm": 273.0},
    {"nps": "12",    "npsDecimal": 12.0,  "dn": 300,  "odIn": 12.750, "odMm": 323.8},
    {"nps": "14",    "npsDecimal": 14.0,  "dn": 350,  "odIn": 14.000, "odMm": 355.6},
    {"nps": "16",    "npsDecimal": 16.0,  "dn": 400,  "odIn": 16.000, "odMm": 406.4},
    {"nps": "18",    "npsDecimal": 18.0,  "dn": 450,  "odIn": 18.000, "odMm": 457.0},
    {"nps": "20",    "npsDecimal": 20.0,  "dn": 500,  "odIn": 20.000, "odMm": 508.0},
    {"nps": "22",    "npsDecimal": 22.0,  "dn": 550,  "odIn": 22.000, "odMm": 559.0},
    {"nps": "24",    "npsDecimal": 24.0,  "dn": 600,  "odIn": 24.000, "odMm": 610.0},
    {"nps": "26",    "npsDecimal": 26.0,  "dn": 650,  "odIn": 26.000, "odMm": 660.0},
    {"nps": "28",    "npsDecimal": 28.0,  "dn": 700,  "odIn": 28.000, "odMm": 711.0},
    {"nps": "30",    "npsDecimal": 30.0,  "dn": 750,  "odIn": 30.000, "odMm": 762.0},
    {"nps": "32",    "npsDecimal": 32.0,  "dn": 800,  "odIn": 32.000, "odMm": 813.0},
    {"nps": "34",    "npsDecimal": 34.0,  "dn": 850,  "odIn": 34.000, "odMm": 864.0},
    {"nps": "36",    "npsDecimal": 36.0,  "dn": 900,  "odIn": 36.000, "odMm": 914.0},
    {"nps": "38",    "npsDecimal": 38.0,  "dn": 950,  "odIn": 38.000, "odMm": 965.0},
    {"nps": "40",    "npsDecimal": 40.0,  "dn": 1000, "odIn": 40.000, "odMm": 1016.0},
    {"nps": "42",    "npsDecimal": 42.0,  "dn": 1050, "odIn": 42.000, "odMm": 1067.0},
    {"nps": "44",    "npsDecimal": 44.0,  "dn": 1100, "odIn": 44.000, "odMm": 1118.0},
    {"nps": "46",    "npsDecimal": 46.0,  "dn": 1150, "odIn": 46.000, "odMm": 1168.0},
    {"nps": "48",    "npsDecimal": 48.0,  "dn": 1200, "odIn": 48.000, "odMm": 1219.0}
  ]
}
